{
  "controlIdentifier": "example-value",
  "enabledControlIdentifier": "example-value",
  "endTime": "2025-03-15T14:30:00Z",
  "operationIdentifier": "a1b2c3d4-5678-90ab-cdef-EXAMPLE11111",
  "operationType": "ENABLE_CONTROL",
  "startTime": "2025-03-15T14:30:00Z",
  "status": "SUCCEEDED",
  "statusMessage": "SUCCEEDED",
  "targetIdentifier": "example-value"
}